<?xml version="1.0" encoding="UTF-8"?>
<!--
To change this license header, choose License Headers in Project Properties.
To change this template file, choose Tools | Templates
and open the template in the editor.
-->


<etudiant
    xmlns:xsi='http://www.w3.org/2001/XMLSchema-instance'
    xmlns='http://polytech-grenoble.fr/TIS/OrigineEtudiant'
    xsi:schemaLocation='http://polytech-grenoble.fr/TIS/OrigineEtudiant OrigineEtudiant.xsd'>
    <nom>RANDRIANARIVELO</nom>
    <prénom>Tiaviniaina</prénom>
    <sexe>M</sexe>
    <origine>
        <filière>DUT</filière>
        <spécialitéFilière>Réseaux et Télécommunications</spécialitéFilière>
        <major>Mathématiques et Informatique</major>
        <géographie>
            <région>Rhône-Alpes Auvergne</région>
            <ville>Grenoble</ville>
        </géographie>
    </origine>

</etudiant>
